{
  "schema_version": "event-occurrence/v1",
  "source_event_id": null,
  "source_url": "https://www.jagrititheatre.com/12-angry-men1",
  "source_host": "www.jagrititheatre.com",
  "city_slug": "bengaluru",
  "title": "12 Angry Men",
  "category": "theatre",
  "start_date": "2026-08-22",
  "starts_at": "2026-08-22T15:30:00+05:30",
  "end_date": "2026-08-22",
  "ends_at": "2026-08-22T17:35:00+05:30",
  "time_precision": "timed",
  "timezone": "Asia/Kolkata",
  "venue_name": "Jagriti Theatre",
  "venue_address": "Jagriti, Ramagondanahalli, Varthur Road, Whitefield, Bengaluru 560066, India",
  "is_free": false,
  "price_min_minor": 50000,
  "price_max_minor": 50000,
  "currency": "INR",
  "registration_url": "https://in.bookmyshow.com/plays/12-angry-men/ET00503483",
  "registration_state": null,
  "status": "scheduled",
  "language": ["Hindi"],
  "age_note": "8+",
  "accessibility_note": null,
  "image_url": "https://www.jagrititheatre.com/uploads/images/thumbnails/3b16dfb8798e158467a93e9038709426.jpg",
  "observed_at": "2026-08-18T17:12:19Z"
}
