{
  "schema_version": "event-occurrence/v1",
  "source_event_id": "example-2026-08-18",
  "source_url": "https://bangaloreinternationalcentre.org/events/example-event/",
  "source_host": "bangaloreinternationalcentre.org",
  "city_slug": "bengaluru",
  "title": "Example source-derived event",
  "category": "talks",
  "start_date": "2026-08-18",
  "starts_at": "2026-08-18T18:30:00+05:30",
  "end_date": "2026-08-18",
  "ends_at": "2026-08-18T20:00:00+05:30",
  "time_precision": "timed",
  "timezone": "Asia/Kolkata",
  "venue_name": "Bangalore International Centre",
  "venue_address": "Domlur, Bengaluru",
  "is_free": null,
  "price_min_minor": null,
  "price_max_minor": null,
  "currency": null,
  "registration_url": "https://bangaloreinternationalcentre.org/events/example-event/",
  "registration_state": null,
  "status": "scheduled",
  "language": ["English"],
  "age_note": null,
  "accessibility_note": null,
  "image_url": null,
  "observed_at": "2026-08-18T12:00:00Z"
}
